{
  "epoch_id": "EPOCH-48",
  "sha": "de58f865cbeea8bc96d6a05b86f20863e3faff7a",
  "node": "v20.19.6",
  "npm": "11.4.2",
  "date": "2026-02-13T18:45:44.167Z",
  "gate_runs": [
    {
      "path": "gates/npm_ci.log",
      "sha256": "60be1d9925ea05cdf0498e47564faeee727f29ae5db49c6eec9f11d4fef0fc52",
      "status": "UNKNOWN"
    },
    {
      "path": "gates/release_build.log",
      "sha256": "57868cd1f6f5aa12f1909ba4c6c66f636498ce851158f75e8e6918e09ec3861d",
      "status": "UNKNOWN"
    },
    {
      "path": "gates/verify_edge.run1.log",
      "sha256": "516ad70a50c5fdea9afc1ddcd9fc5991d3c8944aea5119e88153319f4647e5d4",
      "status": "PASS"
    },
    {
      "path": "gates/verify_edge.run2.log",
      "sha256": "516ad70a50c5fdea9afc1ddcd9fc5991d3c8944aea5119e88153319f4647e5d4",
      "status": "PASS"
    },
    {
      "path": "gates/verify_ledger.run1.log",
      "sha256": "d336db69c15f7b0624dbc3f42ee634c9ab485589a7fa9d4e3c346dd3c737c30e",
      "status": "PASS"
    },
    {
      "path": "gates/verify_ledger.run2.log",
      "sha256": "d336db69c15f7b0624dbc3f42ee634c9ab485589a7fa9d4e3c346dd3c737c30e",
      "status": "PASS"
    },
    {
      "path": "gates/verify_release.run1.log",
      "sha256": "13a6a31d4f435c5982615224b1e3985bc0ede4dbf9a1820628e2c4c5ac3a9f95",
      "status": "PASS"
    },
    {
      "path": "gates/verify_release.run2.log",
      "sha256": "13a6a31d4f435c5982615224b1e3985bc0ede4dbf9a1820628e2c4c5ac3a9f95",
      "status": "PASS"
    },
    {
      "path": "gates/verify_release.strict.log",
      "sha256": "13a6a31d4f435c5982615224b1e3985bc0ede4dbf9a1820628e2c4c5ac3a9f95",
      "status": "PASS"
    },
    {
      "path": "gates/verify_repo.run1.log",
      "sha256": "c0ac40edfbe626c04716082f200b4963b7ab64b4eaa5abc33bc411910427775e",
      "status": "PASS"
    },
    {
      "path": "gates/verify_repo.run2.log",
      "sha256": "c0ac40edfbe626c04716082f200b4963b7ab64b4eaa5abc33bc411910427775e",
      "status": "PASS"
    },
    {
      "path": "gates/verify_specs.run1.log",
      "sha256": "d7db00ec79aa256865d996d2fd9b12a1155dc2b8749f525b0781cf56ee1c9d10",
      "status": "PASS"
    },
    {
      "path": "gates/verify_specs.run2.log",
      "sha256": "d7db00ec79aa256865d996d2fd9b12a1155dc2b8749f525b0781cf56ee1c9d10",
      "status": "PASS"
    },
    {
      "path": "gates/verify_treasure.run1.log",
      "sha256": "4af177783b24869435770bff0ca27c05efd897ec2e4bbd4112dc7422f4c1aede",
      "status": "PASS"
    },
    {
      "path": "gates/verify_treasure.run2.log",
      "sha256": "4af177783b24869435770bff0ca27c05efd897ec2e4bbd4112dc7422f4c1aede",
      "status": "PASS"
    }
  ],
  "artifacts": [],
  "hashes": {
    "PREFLIGHT.log": "4222187dd69746cebd59c4b6650307292fc4c749be1e11d4b4765fa2f2713fd6",
    "COMMANDS.log": "efa228cccfec2b0a8f2af83b047a1c70d42e967047c0bc71876e8c04b35374a7",
    "SNAPSHOT.md": "a896bc843c481d27fc46bcede398aa7d1bff2c132b122c3f254380620427f390",
    "SUMMARY.md": "4dfbaaa0918b8e9eb65d27e21e799ccabc12789de0862a1d9fe10e01d9c3c708",
    "VERDICT.md": "437ef468f6a2c6dc01e8ce31a513df632430981605c24500681fb8f8e8a7312d"
  }
}
