{
  "epoch_id": "EPOCH-21",
  "sha": "88236ad746d0b81866e75a47f2f9b2dd41d1f1ab",
  "node": "v20.19.6",
  "npm": "11.4.2",
  "date": "2026-02-13T20:29:46.965Z",
  "gate_runs": [
    {
      "path": "gates/run1.log",
      "sha256": "553aa4fcf67982a6146ea8e3eb7a0b5623e651b3b5c0d877e78ac3100a48683a",
      "status": "PASS"
    },
    {
      "path": "gates/run2.log",
      "sha256": "553aa4fcf67982a6146ea8e3eb7a0b5623e651b3b5c0d877e78ac3100a48683a",
      "status": "PASS"
    },
    {
      "path": "gates/verify_epoch21_run1.log",
      "sha256": "4f42e59d235160ea33d203e5109388461e32484bf255bd3d0aebbab3b6563488",
      "status": "PASS"
    },
    {
      "path": "gates/verify_release_governor_run1.log",
      "sha256": "4935d1a5fe0a179ad009ac99422a0eb02da11725ae16d0737d9f625eec56a375",
      "status": "PASS"
    },
    {
      "path": "gates/verify_release_governor_run2.log",
      "sha256": "4935d1a5fe0a179ad009ac99422a0eb02da11725ae16d0737d9f625eec56a375",
      "status": "PASS"
    }
  ],
  "artifacts": [
    {
      "path": "PLAN.md",
      "sha256": "14927fe23c0c59f56b4cf6b8b5d4e2bff4ecf8cf2f708ffc55506a65a5305a80"
    }
  ],
  "hashes": {
    "PREFLIGHT.log": "d9d6be8adc48444e2263b355e0ac9e17b061b54c3cb591926c486a32d257554a",
    "COMMANDS.log": "ed4f90e74d085087482d8e9ca479f38e5db6c1180b4d2e8af0d90160e0eafb69",
    "SNAPSHOT.md": "f9646d3ffbd07a76a48483128ad89e82c6db34df5c6dad1117d29e138bad8727",
    "SUMMARY.md": "ed0a73c447c52758086932c6420eee9afac47d5216492c41aa9aeec70727e9d7",
    "VERDICT.md": "ffe92370bc644ac7e7a813bc547bb24a91ef7fea8409b4004cd4c49cc7766a6a"
  }
}
