{
  "epoch_id": "EPOCH-19",
  "sha": "88236ad746d0b81866e75a47f2f9b2dd41d1f1ab",
  "node": "v20.19.6",
  "npm": "11.4.2",
  "date": "2026-02-13T20:27:26.201Z",
  "gate_runs": [
    {
      "path": "gates/npm_ci.log",
      "sha256": "66c7121eceb9117f327f52b5ea3ecd88eb40c45462d2466b8e98ebabc391b4a9",
      "status": "UNKNOWN"
    },
    {
      "path": "gates/run1.log",
      "sha256": "15edca7d33ca1d42025dd478f98fa3a18e8a91b13da52d55e17b719a95177470",
      "status": "PASS"
    },
    {
      "path": "gates/run2.log",
      "sha256": "15edca7d33ca1d42025dd478f98fa3a18e8a91b13da52d55e17b719a95177470",
      "status": "PASS"
    },
    {
      "path": "gates/source_manifest_check.log",
      "sha256": "dd7160e304bc70d43f0f71d6199c9e7c5f6ba9a02d2e2d75f6a3276410e1c9aa",
      "status": "UNKNOWN"
    },
    {
      "path": "gates/verify_core_run1.log",
      "sha256": "32ebad3e2c45624f7826fde5ca81ba47280e6bceb81251da30c28c6b23124509",
      "status": "PASS"
    },
    {
      "path": "gates/verify_e2_multi_run1.log",
      "sha256": "db519326af5b7d10e937eaa5b0928c11629bc03db935d88aa5be9af898790514",
      "status": "PASS"
    },
    {
      "path": "gates/verify_e2_run1.log",
      "sha256": "4a82775c5187d9999d7b27eff1dcc1758a99715acbf88ace3b6bcbdee6cd1b45",
      "status": "PASS"
    },
    {
      "path": "gates/verify_e2_run2.log",
      "sha256": "bf106c0bc41f477cdbf7511d4f37caf02ab1617c6f093c7e01acbfe024775138",
      "status": "PASS"
    },
    {
      "path": "gates/verify_epoch19_run1.log",
      "sha256": "36c9a303db61e91fc05392af6da485a07eb75008bc6dd3fe74a8b1bd561ea1b4",
      "status": "PASS"
    },
    {
      "path": "gates/verify_governance_run1.log",
      "sha256": "3c313a14b1fb4f6bb871a28abc611db34e71e522edfa2094ad837180cbcec4c4",
      "status": "PASS"
    },
    {
      "path": "gates/verify_governance_run2.log",
      "sha256": "3c313a14b1fb4f6bb871a28abc611db34e71e522edfa2094ad837180cbcec4c4",
      "status": "PASS"
    },
    {
      "path": "gates/verify_integration_run1.log",
      "sha256": "1ec065fface7be4d592f9942cbf524175f7d572b3a84a063dd8d8532fdf03282",
      "status": "PASS"
    },
    {
      "path": "gates/verify_paper_run1.log",
      "sha256": "702f5c929ff32ea1cc749438b26b7032c0468a164ef129d72789773d7fe9882a",
      "status": "PASS"
    },
    {
      "path": "gates/verify_paper_run2.log",
      "sha256": "5b23f0c5a5f700ecb4f1a087faa0c84f1464703f38803fff18b7383c181da3e0",
      "status": "PASS"
    },
    {
      "path": "gates/verify_phase2_run1.log",
      "sha256": "defc6cde88bba5459837eaf656ed7279a7ebf9f6a3f62df9b819ccab501e52ab",
      "status": "PASS"
    }
  ],
  "artifacts": [
    {
      "path": "ASSUMPTIONS_LEDGER.md",
      "sha256": "3188846e831fcaa3897f8abbacb29d7cbcfdb0c52e38a0c62469c431f6cfa8c5"
    },
    {
      "path": "DIFF.patch",
      "sha256": "e9d4723b8d1e6b4655df741d9bd3b40282944465763c0929b4866a1b24de2a88"
    },
    {
      "path": "GATE_PLAN.md",
      "sha256": "725b78710fec854e7fea70831eb6f5488b255e7793f3fa5c0b3ada6857685b7f"
    },
    {
      "path": "INVENTORY.txt",
      "sha256": "68056971da3af1820e1b2c77f1619383afcd5e57f30347c104ded16335696bdf"
    },
    {
      "path": "NEXT.md",
      "sha256": "56fe4ec1f24f7e5ef89ae801c2f66b9618d910e14aa5566c17bb038714e8c048"
    },
    {
      "path": "PLAN.md",
      "sha256": "6e22935836d26c6b74878497c08fbb3b31056c0e59d266979ac6e8d0718e5ba3"
    },
    {
      "path": "RISK_REGISTER.md",
      "sha256": "e2ac7045ff8a04043ab26c4bf36175c8d09f29b2bd4120004d09b2202a84d03c"
    },
    {
      "path": "SHA256SUMS.EVIDENCE.txt",
      "sha256": "23629eab3e4a8e97ed6a3d8bb5a44a67fc33e97d4b48160e8877e8ca65329827"
    },
    {
      "path": "SHA256SUMS.EXPORT.txt",
      "sha256": "546995de236ba4db560ab13ec12aac4d7cbb54176d8cea7b0f74f9e1879313d5"
    },
    {
      "path": "SHA256SUMS.SOURCE.txt",
      "sha256": "50ad4cf889498fa0fb3b61205f9b52182278c37eae1920ed4df1f0421a40251e"
    },
    {
      "path": "SHA256SUMS.txt",
      "sha256": "db7eb4670d96574a75ba022ead101f566c5b46508af4ee3f7b2a78a610fef220"
    }
  ],
  "hashes": {
    "PREFLIGHT.log": "b58b02909256d07bda5c33303bce917fbfdef18fd4cde56602395dc9211a370c",
    "COMMANDS.log": "f39c3571e48194b33a9a199bbd581966e0a8e422da53c3054991a688de50ded8",
    "SNAPSHOT.md": "af70c961bdf17c2a67e47bbf8d80c31f768897f82987b1067cd3e8d6f26b7484",
    "SUMMARY.md": "2227821bc16c98b5d0795ea498bde4d67f406edf32b4b4586bed66ad34c2147a",
    "VERDICT.md": "7e50652005c5990d4dd141c200f44a2a44bbe9ed9d5affa93b350e94d9f0d010"
  }
}
