{
  "epoch_id": "EPOCH-62",
  "sha": "b8bdf8006f08bc48e9371c2d696313edf89320d0",
  "node": "v20.19.6",
  "npm": "11.4.2",
  "date": "2026-02-14T01:52:35.024Z",
  "gate_runs": [
    {
      "path": "gates/npm_ci.log",
      "sha256": "fce38ce057893af0195475e2ffdecc10223d758ab530b454847f09c879553b1e",
      "status": "UNKNOWN"
    },
    {
      "path": "gates/release_build.log",
      "sha256": "2ffae865b23fdd6aca3344f3701bf51d4bf3a86bfea296b8dfb3f7997e4641cb",
      "status": "UNKNOWN"
    },
    {
      "path": "gates/verify_docs.run1.log",
      "sha256": "9c22fe1fc332919d12a03268626d058be1dfd0383bd2f329b2901207a3c75cd5",
      "status": "PASS"
    },
    {
      "path": "gates/verify_docs.run2.log",
      "sha256": "9c22fe1fc332919d12a03268626d058be1dfd0383bd2f329b2901207a3c75cd5",
      "status": "PASS"
    },
    {
      "path": "gates/verify_edge.run1.log",
      "sha256": "516ad70a50c5fdea9afc1ddcd9fc5991d3c8944aea5119e88153319f4647e5d4",
      "status": "PASS"
    },
    {
      "path": "gates/verify_edge.run2.log",
      "sha256": "516ad70a50c5fdea9afc1ddcd9fc5991d3c8944aea5119e88153319f4647e5d4",
      "status": "PASS"
    },
    {
      "path": "gates/verify_ledger.run1.log",
      "sha256": "21a9ce58cbc3bacad0feaf468c89f87f01a3a9afca8762a3872b366833e855e9",
      "status": "PASS"
    },
    {
      "path": "gates/verify_ledger.run2.log",
      "sha256": "21a9ce58cbc3bacad0feaf468c89f87f01a3a9afca8762a3872b366833e855e9",
      "status": "PASS"
    },
    {
      "path": "gates/verify_phoenix.run1.log",
      "sha256": "7c93377d5a856731cfda65c7b0229325ebefebdc551ec0e42f10e926a047d290",
      "status": "PASS"
    },
    {
      "path": "gates/verify_phoenix.run2.log",
      "sha256": "c37991df8fd1081e5b92dd9f058723113cddd49dd8e8acc2476eeaf5b36606c0",
      "status": "PASS"
    },
    {
      "path": "gates/verify_properties.run1.log",
      "sha256": "0121f4e98dabc7958ae1ddcf92bed050e7c0e8a98e8a1a823b4bb2697b0e9c27",
      "status": "PASS"
    },
    {
      "path": "gates/verify_properties.run2.log",
      "sha256": "0121f4e98dabc7958ae1ddcf92bed050e7c0e8a98e8a1a823b4bb2697b0e9c27",
      "status": "PASS"
    },
    {
      "path": "gates/verify_reachability.run1.log",
      "sha256": "8b6d366d626673827d4cb15d48b70dcfcdf3f69d924be847627f601c33de3d9e",
      "status": "PASS"
    },
    {
      "path": "gates/verify_reachability.run2.log",
      "sha256": "8b6d366d626673827d4cb15d48b70dcfcdf3f69d924be847627f601c33de3d9e",
      "status": "PASS"
    },
    {
      "path": "gates/verify_release.run1.log",
      "sha256": "13a6a31d4f435c5982615224b1e3985bc0ede4dbf9a1820628e2c4c5ac3a9f95",
      "status": "PASS"
    },
    {
      "path": "gates/verify_release.run2.log",
      "sha256": "13a6a31d4f435c5982615224b1e3985bc0ede4dbf9a1820628e2c4c5ac3a9f95",
      "status": "PASS"
    },
    {
      "path": "gates/verify_repo.run1.log",
      "sha256": "2bc9805e76bcb6196bd8e9615f82f032f297786c427a9edbfbf4f7e9c507de98",
      "status": "PASS"
    },
    {
      "path": "gates/verify_repo.run2.log",
      "sha256": "2bc9805e76bcb6196bd8e9615f82f032f297786c427a9edbfbf4f7e9c507de98",
      "status": "PASS"
    },
    {
      "path": "gates/verify_specs.run1.log",
      "sha256": "9cffb46c4f7f45cd5046a70fd6396c9630f93942a272885f5b4b1699c11b7e79",
      "status": "PASS"
    },
    {
      "path": "gates/verify_specs.run2.log",
      "sha256": "9cffb46c4f7f45cd5046a70fd6396c9630f93942a272885f5b4b1699c11b7e79",
      "status": "PASS"
    },
    {
      "path": "gates/verify_treasure.run1.log",
      "sha256": "e286eb1b41a3423841d7fa47fd50607c2eeb37344c5e9072c60778ac2a6741bb",
      "status": "PASS"
    },
    {
      "path": "gates/verify_treasure.run2.log",
      "sha256": "e286eb1b41a3423841d7fa47fd50607c2eeb37344c5e9072c60778ac2a6741bb",
      "status": "PASS"
    }
  ],
  "artifacts": [
    {
      "path": "gates/manual/docs_anchor_contract_check.json",
      "sha256": "7f26a8bdf570feb8469a000704848be6d8586d26e98e827c759112d27551a54f"
    },
    {
      "path": "gates/manual/golden_vectors_manifest.json",
      "sha256": "d2f83ef66bf2b62af7f4bfc780c9b2de0ac69b9e0eab7090b5102d1b490cc1ee"
    },
    {
      "path": "gates/manual/properties_report.json",
      "sha256": "4abe15ddc4ac7ddfab982591ff398c9c1a2f49451a2916910a71ad3119028cff"
    },
    {
      "path": "gates/manual/reachability_report.json",
      "sha256": "939e393b439e21940a4ffbe4406b4a21b5ac1e0f97f6b6db6cfb54900e89eb75"
    },
    {
      "path": "gates/manual/verify_epoch62_result.json",
      "sha256": "46e7b64a0fc7c3993b6d8abd5d06512e70ec00b6ae984f2a2571b6a586df7df8"
    }
  ],
  "hashes": {
    "COMMANDS.log": "a45f674a2dd25cc8a5836e764395330c6adab5135409eab64ad774f7372956ac",
    "PREFLIGHT.log": "7322bc4f6ca660b74a04accf8f89b9cdee71c89028cf2339d3db9243c6ff471a",
    "SNAPSHOT.md": "57bcc4d6a347d922c31a19013923316fd1c4e680c064d3c18695b5d8add3f8a6",
    "SUMMARY.md": "7622090fc2f42dbd098bad97ef7db7311fd7000faf5839def423ad8c3bcadd95",
    "VERDICT.md": "79e5da28edae0049714ea58f7846d000a342043382265d294aa561bd46b72763",
    "gates/manual/docs_anchor_contract_check.json": "7f26a8bdf570feb8469a000704848be6d8586d26e98e827c759112d27551a54f",
    "gates/manual/golden_vectors_manifest.json": "d2f83ef66bf2b62af7f4bfc780c9b2de0ac69b9e0eab7090b5102d1b490cc1ee",
    "gates/manual/properties_report.json": "4abe15ddc4ac7ddfab982591ff398c9c1a2f49451a2916910a71ad3119028cff",
    "gates/manual/reachability_report.json": "939e393b439e21940a4ffbe4406b4a21b5ac1e0f97f6b6db6cfb54900e89eb75",
    "gates/manual/verify_epoch62_result.json": "46e7b64a0fc7c3993b6d8abd5d06512e70ec00b6ae984f2a2571b6a586df7df8",
    "gates/npm_ci.log": "fce38ce057893af0195475e2ffdecc10223d758ab530b454847f09c879553b1e",
    "gates/release_build.log": "2ffae865b23fdd6aca3344f3701bf51d4bf3a86bfea296b8dfb3f7997e4641cb",
    "gates/verify_docs.run1.log": "9c22fe1fc332919d12a03268626d058be1dfd0383bd2f329b2901207a3c75cd5",
    "gates/verify_docs.run2.log": "9c22fe1fc332919d12a03268626d058be1dfd0383bd2f329b2901207a3c75cd5",
    "gates/verify_edge.run1.log": "516ad70a50c5fdea9afc1ddcd9fc5991d3c8944aea5119e88153319f4647e5d4",
    "gates/verify_edge.run2.log": "516ad70a50c5fdea9afc1ddcd9fc5991d3c8944aea5119e88153319f4647e5d4",
    "gates/verify_ledger.run1.log": "21a9ce58cbc3bacad0feaf468c89f87f01a3a9afca8762a3872b366833e855e9",
    "gates/verify_ledger.run2.log": "21a9ce58cbc3bacad0feaf468c89f87f01a3a9afca8762a3872b366833e855e9",
    "gates/verify_phoenix.run1.log": "7c93377d5a856731cfda65c7b0229325ebefebdc551ec0e42f10e926a047d290",
    "gates/verify_phoenix.run2.log": "c37991df8fd1081e5b92dd9f058723113cddd49dd8e8acc2476eeaf5b36606c0",
    "gates/verify_properties.run1.log": "0121f4e98dabc7958ae1ddcf92bed050e7c0e8a98e8a1a823b4bb2697b0e9c27",
    "gates/verify_properties.run2.log": "0121f4e98dabc7958ae1ddcf92bed050e7c0e8a98e8a1a823b4bb2697b0e9c27",
    "gates/verify_reachability.run1.log": "8b6d366d626673827d4cb15d48b70dcfcdf3f69d924be847627f601c33de3d9e",
    "gates/verify_reachability.run2.log": "8b6d366d626673827d4cb15d48b70dcfcdf3f69d924be847627f601c33de3d9e",
    "gates/verify_release.run1.log": "13a6a31d4f435c5982615224b1e3985bc0ede4dbf9a1820628e2c4c5ac3a9f95",
    "gates/verify_release.run2.log": "13a6a31d4f435c5982615224b1e3985bc0ede4dbf9a1820628e2c4c5ac3a9f95",
    "gates/verify_repo.run1.log": "2bc9805e76bcb6196bd8e9615f82f032f297786c427a9edbfbf4f7e9c507de98",
    "gates/verify_repo.run2.log": "2bc9805e76bcb6196bd8e9615f82f032f297786c427a9edbfbf4f7e9c507de98",
    "gates/verify_specs.run1.log": "9cffb46c4f7f45cd5046a70fd6396c9630f93942a272885f5b4b1699c11b7e79",
    "gates/verify_specs.run2.log": "9cffb46c4f7f45cd5046a70fd6396c9630f93942a272885f5b4b1699c11b7e79",
    "gates/verify_treasure.run1.log": "e286eb1b41a3423841d7fa47fd50607c2eeb37344c5e9072c60778ac2a6741bb",
    "gates/verify_treasure.run2.log": "e286eb1b41a3423841d7fa47fd50607c2eeb37344c5e9072c60778ac2a6741bb",
    "pack_index.json": "d989256497fcf7bce5fc2f7e919111b324b8e1764c56a7bdd925d64074761ec6"
  }
}
