{
  "epoch_id": "EPOCH-57",
  "sha": "78c852289e4c8bbe01b411d0797c0a265163250e",
  "node": "v20.19.6",
  "npm": "11.4.2",
  "date": "2026-02-13T17:47:50.919Z",
  "gate_runs": [
    {
      "path": "gates/npm_ci.log",
      "sha256": "ad615806a667812b38d25b7e05316933e06fab004a79fa1e385f59f944f962e5",
      "status": "UNKNOWN"
    },
    {
      "path": "gates/npm_ci_run1.log",
      "sha256": "5e16090a3ae3800676cac0fa3ee28c0c645529d8250deaec0cbbfc76e77848b6",
      "status": "UNKNOWN"
    },
    {
      "path": "gates/npm_ci_run2.log",
      "sha256": "5e16090a3ae3800676cac0fa3ee28c0c645529d8250deaec0cbbfc76e77848b6",
      "status": "UNKNOWN"
    },
    {
      "path": "gates/release_build.log",
      "sha256": "106a4fc0e013b2b0ba91b372753ccb737617f40e2f9fe2ebd49530fe8252a9ac",
      "status": "UNKNOWN"
    },
    {
      "path": "gates/verify_edge_run1.log",
      "sha256": "fcb81d592d0f0c2561e618c47ef0ee3cb805cdd7ec446282166a0af7c117d82a",
      "status": "PASS"
    },
    {
      "path": "gates/verify_edge_run2.log",
      "sha256": "fcb81d592d0f0c2561e618c47ef0ee3cb805cdd7ec446282166a0af7c117d82a",
      "status": "PASS"
    },
    {
      "path": "gates/verify_epochs_freeze_run1.log",
      "sha256": "f597ae6c633ea55502e0e2101f2694ed579108dd5ca3595e2118ee1921055d17",
      "status": "PASS"
    },
    {
      "path": "gates/verify_epochs_freeze_run2.log",
      "sha256": "f597ae6c633ea55502e0e2101f2694ed579108dd5ca3595e2118ee1921055d17",
      "status": "PASS"
    },
    {
      "path": "gates/verify_ledger_run1.log",
      "sha256": "e46907c6195f8b1f1db554f3c15b3c00af3a606ed49a45f8bca682bf6cec8ec4",
      "status": "PASS"
    },
    {
      "path": "gates/verify_ledger_run2.log",
      "sha256": "e46907c6195f8b1f1db554f3c15b3c00af3a606ed49a45f8bca682bf6cec8ec4",
      "status": "PASS"
    },
    {
      "path": "gates/verify_release_build_run1.log",
      "sha256": "4fbeb643b3212fcb08b167315049d47c9b554d06bd28567b9edd26f6ce53d3e2",
      "status": "PASS"
    },
    {
      "path": "gates/verify_release_build_run2.log",
      "sha256": "4fbeb643b3212fcb08b167315049d47c9b554d06bd28567b9edd26f6ce53d3e2",
      "status": "PASS"
    },
    {
      "path": "gates/verify_release_strict_run1.log",
      "sha256": "4fbeb643b3212fcb08b167315049d47c9b554d06bd28567b9edd26f6ce53d3e2",
      "status": "PASS"
    },
    {
      "path": "gates/verify_repo_run1.log",
      "sha256": "ae90f9f2d25db3e4eac35fff99048c97e5b26e993f8cfb23f9adf8e105964437",
      "status": "PASS"
    },
    {
      "path": "gates/verify_repo_run2.log",
      "sha256": "ae90f9f2d25db3e4eac35fff99048c97e5b26e993f8cfb23f9adf8e105964437",
      "status": "PASS"
    },
    {
      "path": "gates/verify_specs_run1.log",
      "sha256": "9bae8ce47bd2b1a29108134d2c78af54060e786f6a6c1ec38b4a0585da70b21b",
      "status": "PASS"
    },
    {
      "path": "gates/verify_specs_run2.log",
      "sha256": "9bae8ce47bd2b1a29108134d2c78af54060e786f6a6c1ec38b4a0585da70b21b",
      "status": "PASS"
    },
    {
      "path": "gates/verify_treasure_run1.log",
      "sha256": "41446f427988662cffc3e8d049820c2da3dfb837f6ad8fbebf90ff999cbeef0f",
      "status": "PASS"
    },
    {
      "path": "gates/verify_treasure_run2.log",
      "sha256": "41446f427988662cffc3e8d049820c2da3dfb837f6ad8fbebf90ff999cbeef0f",
      "status": "PASS"
    }
  ],
  "artifacts": [],
  "hashes": {
    "PREFLIGHT.log": "39833dc90185466d2a68b9bab4af1c9c7ada0d275be736e0e4fe93919743b236",
    "COMMANDS.log": "6e4583a2563bd6bb07fd2a2a440456a665af3f5a166aadba28d9a40fad7c3ac1",
    "SNAPSHOT.md": "4d85a051a585eea25d608c2b2a0d46e9cfbf7e514a186230debce70c86b39a66",
    "SUMMARY.md": "a0bb013f5814a181cde19469f7786493f2d1e24a7c42498cdf344af4abd5dcce",
    "VERDICT.md": "4d607aa17f5bf208e4941e868394463fb423e5901bb4bda82ce505e76ead1bf1"
  }
}
