{
  "epoch_id": "EPOCH-24",
  "sha": "88236ad746d0b81866e75a47f2f9b2dd41d1f1ab",
  "node": "v20.19.6",
  "npm": "11.4.2",
  "date": "2026-02-13T20:28:05.667Z",
  "gate_runs": [
    {
      "path": "gates/export_validated.log",
      "sha256": "6762d92b2a18c8d4f5cce30491a4f1a716e3d9c4faac54edd273610dede67521",
      "status": "UNKNOWN"
    },
    {
      "path": "gates/npm_ci.log",
      "sha256": "fce38ce057893af0195475e2ffdecc10223d758ab530b454847f09c879553b1e",
      "status": "UNKNOWN"
    },
    {
      "path": "gates/regen_manifests_boot.log",
      "sha256": "04bc2523154e0151929296da66c1485947d3b58e9272314489fc10e49edb7108",
      "status": "UNKNOWN"
    },
    {
      "path": "gates/regen_manifests_epoch24.log",
      "sha256": "54c660f59fa071f2bfb4a5c75a7c6f7b6e8686e4fd28b59f3e0d4705450176ad",
      "status": "UNKNOWN"
    },
    {
      "path": "gates/run1.log",
      "sha256": "2a02ce29391ba8fb98ff04097dc20aac67b02e60f4a3a81d5d7412015548d475",
      "status": "PASS"
    },
    {
      "path": "gates/run2.log",
      "sha256": "2a02ce29391ba8fb98ff04097dc20aac67b02e60f4a3a81d5d7412015548d475",
      "status": "PASS"
    },
    {
      "path": "gates/sha_evidence_check.log",
      "sha256": "ffc6006cff1440550805f9eaa3913c84341615ed6e3a888462360d0aeaa90510",
      "status": "UNKNOWN"
    },
    {
      "path": "gates/sha_source_check.log",
      "sha256": "6a91934281be9a5d965be1f9935459f8c41ab047af9d7373b484876a55781629",
      "status": "UNKNOWN"
    },
    {
      "path": "gates/verify_core.log",
      "sha256": "d28952bf13b9284a9ef07b7d2ea13d054d379cca2d7d564dc737a37018918356",
      "status": "PASS"
    },
    {
      "path": "gates/verify_epoch24_run1.log",
      "sha256": "82905a08fe0d705d45901ae15751374efc1caaf6e35b661f7d1a00e4971a92e1",
      "status": "PASS"
    },
    {
      "path": "gates/verify_epoch24_run2.log",
      "sha256": "82905a08fe0d705d45901ae15751374efc1caaf6e35b661f7d1a00e4971a92e1",
      "status": "PASS"
    },
    {
      "path": "gates/verify_integration.log",
      "sha256": "6c976634e4acc90e3b8655b7af54f5d290b97ec97b7bdf3bf8c89783fe15e3dd",
      "status": "PASS"
    },
    {
      "path": "gates/verify_phase2.log",
      "sha256": "8120d6dfa80fba9b1a30c076693724edc0de80332221ff320a7513de84d84109",
      "status": "PASS"
    },
    {
      "path": "gates/verify_phase2_pre_epoch24.log",
      "sha256": "4d47796f359d3067c6662e49ae271bb96377eab8cd72633e40d702cdda7b60a5",
      "status": "PASS"
    },
    {
      "path": "gates/verify_wall.log",
      "sha256": "96d243987423cc1e25dd856f90e8db6a764d1f6062be42bb55f4cdd1969c9b24",
      "status": "PASS"
    }
  ],
  "artifacts": [
    {
      "path": "ASSUMPTIONS.md",
      "sha256": "8949b17ec8c570d21908845675ab5dd63cf5b5b5d958a1f38d8e60add3665c78"
    },
    {
      "path": "DIFF.patch",
      "sha256": "e7106982f0808b27a5c2463c3a64809a01ca1c40a11d7a480ac39191a3f7b9be"
    },
    {
      "path": "GATE_PLAN.md",
      "sha256": "e9c4fbe0c4587b01e2923db8c5a611971012154c8498450d516dbfe4f4cafc2f"
    },
    {
      "path": "INVENTORY.txt",
      "sha256": "55e08294d521a538431915c3ad68ad6e0fa228c0a42a0d618d64d1005e05ac5a"
    },
    {
      "path": "PREFLIGHT.md",
      "sha256": "7b30da7b31f6c91c3549e23ff9f305d291067f58d78ce3806f80a8a885c51e68"
    },
    {
      "path": "RISK_REGISTER.md",
      "sha256": "c8260a1a983bceaeac914c4a06f372261b0ce6dc19fa4655d285367d8a328742"
    },
    {
      "path": "SHA256SUMS.EVIDENCE.txt",
      "sha256": "cb3c496200d47df80225da5de28c0894f6879883ef6dfb9bf8399b05e1a41dfe"
    },
    {
      "path": "SHA256SUMS.EXPORT.txt",
      "sha256": "4e77cd1b02f663857eed72d953ad9222f1a6c0843e03acba233eca56b8bbee7b"
    },
    {
      "path": "SHA256SUMS.SOURCE.txt",
      "sha256": "eb132b6e87356f169b987674ee3d34098b896ff57cfb1b2a02b6c33e0efb9f79"
    }
  ],
  "hashes": {
    "PREFLIGHT.log": "d9d6be8adc48444e2263b355e0ac9e17b061b54c3cb591926c486a32d257554a",
    "COMMANDS.log": "cb86aa89afba4e30fdcc4a3f009e1b07f906462435d0352cbf1e57e749dbe781",
    "SNAPSHOT.md": "cce8050e823371cf4da286ded23cca2b2cc15f34e200d8efe29bf44d180ce947",
    "SUMMARY.md": "892fe8508ae29afc18642eb42d615c237ff96ed09d31e976f7c8b206d446e34e",
    "VERDICT.md": "76bf5a8b6202c8b6472f637c022fcaa129584e1910de6c2d98b44bed881a2097"
  }
}
